{
  "id": "flashscore-odds",
  "version": "1",
  "title": "Flashscore 1X2 odds pattern (example only — not builtin)",
  "schema": "flashscore_prematch_1x2_v1",
  "confidence": 0.55,
  "ttl_seconds": 300,
  "network": {
    "mode": "open",
    "notes": "Example-only recipe. Not auto-loaded by the runtime. Load explicitly via API_RECIPE_PATHS / --api-recipe-path. With network.mode=open, global api_recipes opt-in alone permits live GETs (no allowlist/consent phrase). Operators must respect Flashscore Terms of Use. Prefer offline fixtures for demos."
  },
  "match": {
    "host_roots": [
      "flashscore.com",
      "flashscore.fr",
      "flashscore.co.uk",
      "flashscore.es",
      "flashscore.de",
      "flashscore.it",
      "flashscore.pl",
      "flashscore.pt",
      "flashscore.nl",
      "flashscore.ro",
      "flashscore.sk",
      "flashscore.cz",
      "flashscore.hu",
      "flashscore.hr",
      "flashscore.si",
      "flashscore.gr",
      "flashscore.com.tr",
      "flashscore.com.br",
      "flashscore.com.ar",
      "flashscore.ua",
      "flashscore.se",
      "flashscore.no",
      "flashscore.dk",
      "flashscore.fi",
      "flashscore.be",
      "flashscore.cl",
      "flashscore.com.mx",
      "flashscore.com.co",
      "flashscore.com.pe",
      "flashscore.com.ve",
      "flashscore.com.uy",
      "flashscore.com.bo",
      "flashscore.com.ec",
      "flashscore.com.py"
    ],
    "path_regex": "/match",
    "query_keys": ["mid"]
  },
  "endpoint": {
    "method": "GET",
    "url_template": "https://2.ds.lsapp.eu/pq_graphql?_hash=ole2&eventId={event_id}&bookmakerId={bookmaker_id}&betType=HOME_DRAW_AWAY&betScope=FULL_TIME",
    "allowed_hosts": ["2.ds.lsapp.eu"],
    "timeout_seconds": 5,
    "max_bytes": 65536,
    "max_fanout": 6,
    "min_interval_ms": 50,
    "max_redirects": 2,
    "headers": {
      "Accept": "application/json"
    }
  },
  "params": {
    "bindings": {
      "event_id": {
        "query": ["mid", "eventId", "event_id"],
        "pattern": "^[A-Za-z0-9]{4,32}$"
      }
    },
    "fanout": {
      "template_var": "bookmaker_id",
      "name_var": "bookmaker_name",
      "items_from": "bookmakers",
      "item_id_key": "id",
      "item_name_key": "name"
    },
    "bet_type": "HOME_DRAW_AWAY",
    "bet_scope": "FULL_TIME",
    "bookmakers": [
      {"id": 141, "name": "Betclic"},
      {"id": 264, "name": "Winamax"},
      {"id": 160, "name": "Unibet"},
      {"id": 1195, "name": "Pmu"},
      {"id": 905, "name": "Betsson"},
      {"id": 1243, "name": "Bet365"}
    ]
  },
  "response": {
    "odds_path": ["data", "findPrematchOddsForBookmaker"],
    "schema": "flashscore_prematch_1x2_v1"
  },
  "warnings": [
    "Example-only (not builtin/supported). Flashscore Terms of Use prohibit automated requests and scraping without express consent (https://www.flashscore.com/terms-of-use/). Prefer offline fixtures; live GETs are the operator's responsibility.",
    "Observed endpoint shape (2.ds.lsapp.eu /pq_graphql _hash=ole2) is undocumented/unstable and may change without notice.",
    "Odds are a dated snapshot for research/agent context only — not betting advice."
  ],
  "fallback": "http_seo_cloak_archive"
}
